{
  "schema_version": 1,
  "scanned_at": "2026-04-21T00:00:00.000Z",
  "eth_price_used": "3200.00",
  "eth_price_source": "fallback",
  "triage_tool_version": "1.0.0",
  "proof_dir": "examples/sample-data",
  "total_proofs": 3,
  "has_critical": true,
  "has_high": true,
  "critical_count": 1,
  "high_count": 1,
  "medium_count": 1,
  "total_usd_impact": "$5,504,560.00",
  "proofs": [
    {
      "file": "examples/sample-data/finding-001.json",
      "proof_hash": "a1b2c3d4e5f6",
      "dedupe_key": "a1b2c3d4e5f6",
      "content_hash": "a1b2c3d4e5f6",
      "eth_price_used": "3200.00",
      "eth_price_source": "fallback",
      "chain": "base",
      "block": 19842271,
      "detector": "OracleFreshnessCheck",
      "userNet": "965625000000000000000",
      "poolNet": "-965625000000000000000",
      "usd_user": "$3,090,000.00",
      "usd_pool": "-$3,090,000.00",
      "usd_impact": "$3,090,000.00",
      "severity": "High",
      "title": "Missing Oracle Freshness Validation",
      "status": "new",
      "finding_id": "example-oracle-freshness-001",
      "protocol": "ExampleLending"
    },
    {
      "file": "examples/sample-data/finding-002.json",
      "proof_hash": "b2c3d4e5f6a1",
      "dedupe_key": "b2c3d4e5f6a1",
      "content_hash": "b2c3d4e5f6a1",
      "eth_price_used": "3200.00",
      "eth_price_source": "fallback",
      "chain": "ethereum",
      "block": 18765432,
      "detector": "CapitalConservation",
      "userNet": "753125000000000000000",
      "poolNet": "-753125000000000000000",
      "usd_user": "$2,410,000.00",
      "usd_pool": "-$2,410,000.00",
      "usd_impact": "$2,410,000.00",
      "severity": "Critical",
      "title": "Capital Conservation Violation in Settlement",
      "status": "new",
      "finding_id": "example-capital-conservation-002",
      "protocol": "ExampleAuction"
    },
    {
      "file": "examples/sample-data/finding-003.json",
      "proof_hash": "c3d4e5f6a1b2",
      "dedupe_key": "c3d4e5f6a1b2",
      "content_hash": "c3d4e5f6a1b2",
      "eth_price_used": "3200.00",
      "eth_price_source": "fallback",
      "chain": "base",
      "block": 19812009,
      "detector": "CloseFactor",
      "userNet": "1425000000000000000",
      "poolNet": "-1425000000000000000",
      "usd_user": "$4,560.00",
      "usd_pool": "-$4,560.00",
      "usd_impact": "$4,560.00",
      "severity": "Medium",
      "title": "Liquidation Close Factor Bypass",
      "status": "triaged",
      "finding_id": "example-close-factor-003",
      "protocol": "ExampleLending"
    }
  ],
  "summary_text": "Sample data — not a live protocol scan. For demonstration purposes only."
}
